{
  "$schema": "../schema/question-bank.schema.json",
  "file_kind": "question_bank",
  "version": "2026.10.0",
  "status": "draft",
  "licence": "CC-BY-4.0",
  "attribution": "Margdarshak content pack, team Chanakya (Nestiq Private Limited), 2026",
  "notes": "Documents, LL conditions and duties. Values quoted from rule packs are listed in rulepack_facts and checked against rulepacks/ by tests; penalties appear only as concepts, never as amounts. SERVER-SIDE CONTENT: items[].key and concepts[].explanation must never reach a client in mock mode; publish only through splitQuestionBank (packages/content). Every item is a draft awaiting two-person review; Hindi awaits native review.",
  "topic": "LL4",
  "confidence_levels": [50, 75, 100],
  "answer_mode": "single_choice",
  "concepts": [
    {
      "concept_id": "C-LL4-001",
      "topic": "LL4",
      "title": {
        "en": "\"L\" plates",
        "hi": "\"L\" प्लेट"
      },
      "sign_family": null,
      "sign_id": null,
      "rule_ids": ["RR-LLC-001"],
      "rulepack_facts": [],
      "explanation": {
        "explanation_id": "EX-C-LL4-001",
        "text": {
          "en": "A learner must display an \"L\" plate on the front and the rear of the vehicle (CMVR r.3).",
          "hi": "लर्नर को वाहन के आगे और पीछे, दोनों जगह \"L\" प्लेट लगानी होती है (CMVR r.3)।"
        },
        "review_status": "draft",
        "hi_review_status": "pending_native_review"
      },
      "sources": [
        {
          "title": "Central Motor Vehicles Rules 1989 r.3, learner's licence conditions (secondary sources only)",
          "url": null,
          "grade": "MK",
          "pin_status": "to_pin",
          "checked_on": null
        }
      ],
      "confidence": "medium",
      "verified": false,
      "vehicle_scope": "All",
      "available_to": "all",
      "review_status": "draft",
      "items": [
        {
          "item_id": "C-LL4-001:v1",
          "variant": 1,
          "pool": "practice",
          "form": "rule_mcq",
          "similarity": {
            "level": 3,
            "basis": "authored"
          },
          "stem": {
            "en": "While riding on a learner's licence, what must your vehicle display?",
            "hi": "लर्नर लाइसेंस पर चलाते समय आपके वाहन पर क्या लगा होना चाहिए?"
          },
          "stem_assets": [],
          "options": [
            {
              "option_id": "a",
              "text": {
                "en": "An \"L\" plate at the front and at the rear",
                "hi": "आगे और पीछे \"L\" प्लेट"
              }
            },
            {
              "option_id": "b",
              "text": {
                "en": "Nothing special",
                "hi": "कुछ ख़ास नहीं"
              }
            },
            {
              "option_id": "c",
              "text": {
                "en": "An \"L\" sticker on your helmet only",
                "hi": "सिर्फ़ हेलमेट पर \"L\" स्टिकर"
              }
            },
            {
              "option_id": "d",
              "text": {
                "en": "A \"new rider\" sign on the back only",
                "hi": "सिर्फ़ पीछे \"नया चालक\" लिखा बोर्ड"
              }
            }
          ],
          "key": {
            "correct_option_id": "a"
          }
        },
        {
          "item_id": "C-LL4-001:v2",
          "variant": 2,
          "pool": "mock",
          "form": "true_false",
          "similarity": {
            "level": 3,
            "basis": "authored"
          },
          "stem": {
            "en": "On a learner's licence, an \"L\" plate on the rear alone is enough. True or false?",
            "hi": "लर्नर लाइसेंस पर सिर्फ़ पीछे \"L\" प्लेट लगाना काफ़ी है। सही या ग़लत?"
          },
          "stem_assets": [],
          "options": [
            {
              "option_id": "a",
              "text": {
                "en": "True",
                "hi": "सही"
              }
            },
            {
              "option_id": "b",
              "text": {
                "en": "False",
                "hi": "ग़लत"
              }
            }
          ],
          "key": {
            "correct_option_id": "b"
          }
        },
        {
          "item_id": "C-LL4-001:v3",
          "variant": 3,
          "pool": "practice",
          "form": "scenario",
          "similarity": {
            "level": 2,
            "basis": "authored"
          },
          "stem": {
            "en": "You get your LL today and want to practise on the road this evening. What do you need on the vehicle?",
            "hi": "आपको आज LL मिला है और आप शाम को सड़क पर अभ्यास करना चाहते हैं। वाहन पर क्या चाहिए?"
          },
          "stem_assets": [],
          "options": [
            {
              "option_id": "a",
              "text": {
                "en": "Your college ID card on the dashboard",
                "hi": "डैशबोर्ड पर आपका कॉलेज आईडी कार्ड"
              }
            },
            {
              "option_id": "b",
              "text": {
                "en": "\"L\" plates front and rear",
                "hi": "आगे और पीछे \"L\" प्लेट"
              }
            },
            {
              "option_id": "c",
              "text": {
                "en": "Nothing, as long as you ride slowly",
                "hi": "कुछ नहीं, बस धीरे चलाएँ"
              }
            },
            {
              "option_id": "d",
              "text": {
                "en": "A sticker of your licence number",
                "hi": "आपके लाइसेंस नंबर का स्टिकर"
              }
            }
          ],
          "key": {
            "correct_option_id": "b"
          }
        }
      ]
    },
    {
      "concept_id": "C-LL4-002",
      "topic": "LL4",
      "title": {
        "en": "Learning under supervision",
        "hi": "निगरानी में सीखना"
      },
      "sign_family": null,
      "sign_id": null,
      "rule_ids": ["RR-LLC-001"],
      "rulepack_facts": [],
      "explanation": {
        "explanation_id": "EX-C-LL4-002",
        "text": {
          "en": "A learner's licence is for learning under supervision: show \"L\" plates and be accompanied by a person who holds a valid driving licence for that vehicle (CMVR r.3).",
          "hi": "लर्नर लाइसेंस निगरानी में सीखने के लिए होता है: \"L\" प्लेट लगाएँ और साथ में ऐसा व्यक्ति हो जिसके पास उस वाहन का वैध ड्राइविंग लाइसेंस हो (CMVR r.3)।"
        },
        "review_status": "draft",
        "hi_review_status": "pending_native_review"
      },
      "sources": [
        {
          "title": "Central Motor Vehicles Rules 1989 r.3, learner's licence conditions (secondary sources only)",
          "url": null,
          "grade": "MK",
          "pin_status": "to_pin",
          "checked_on": null
        }
      ],
      "confidence": "medium",
      "verified": false,
      "vehicle_scope": "All",
      "available_to": "all",
      "review_status": "draft",
      "items": [
        {
          "item_id": "C-LL4-002:v1",
          "variant": 1,
          "pool": "practice",
          "form": "rule_mcq",
          "similarity": {
            "level": 3,
            "basis": "authored"
          },
          "stem": {
            "en": "When practising on a learner's licence, who must be with you?",
            "hi": "लर्नर लाइसेंस पर अभ्यास करते समय आपके साथ कौन होना चाहिए?"
          },
          "stem_assets": [],
          "options": [
            {
              "option_id": "a",
              "text": {
                "en": "Any adult friend",
                "hi": "कोई भी बालिग दोस्त"
              }
            },
            {
              "option_id": "b",
              "text": {
                "en": "Nobody, if you go slowly",
                "hi": "कोई नहीं, अगर आप धीरे चलें"
              }
            },
            {
              "option_id": "c",
              "text": {
                "en": "A person with a valid driving licence for that vehicle",
                "hi": "उस वाहन का वैध ड्राइविंग लाइसेंस रखने वाला व्यक्ति"
              }
            },
            {
              "option_id": "d",
              "text": {
                "en": "Another learner",
                "hi": "कोई दूसरा लर्नर"
              }
            }
          ],
          "key": {
            "correct_option_id": "c"
          }
        },
        {
          "item_id": "C-LL4-002:v2",
          "variant": 2,
          "pool": "mock",
          "form": "scenario",
          "similarity": {
            "level": 3,
            "basis": "authored"
          },
          "stem": {
            "en": "Your friend lends you his bike while you hold only an LL, and you plan to ride alone without \"L\" plates. What is wrong?",
            "hi": "आपके पास सिर्फ़ LL है, दोस्त अपनी बाइक देता है, और आप बिना \"L\" प्लेट के अकेले चलाने वाले हैं। इसमें क्या ग़लत है?"
          },
          "stem_assets": [],
          "options": [
            {
              "option_id": "a",
              "text": {
                "en": "Nothing; an LL lets you ride alone",
                "hi": "कुछ नहीं; LL पर अकेले चला सकते हैं"
              }
            },
            {
              "option_id": "b",
              "text": {
                "en": "Only the plates are missing",
                "hi": "सिर्फ़ प्लेट की कमी है"
              }
            },
            {
              "option_id": "c",
              "text": {
                "en": "Nothing, if the bike's owner agrees",
                "hi": "कुछ नहीं, अगर बाइक का मालिक राज़ी हो"
              }
            },
            {
              "option_id": "d",
              "text": {
                "en": "You need \"L\" plates and must follow the LL conditions, including a licensed person with you",
                "hi": "\"L\" प्लेट चाहिए और LL की शर्तें माननी होंगी, जिसमें साथ में लाइसेंस वाला व्यक्ति होना भी शामिल है"
              }
            }
          ],
          "key": {
            "correct_option_id": "d"
          }